{"workspaceExport":{"profile":"openshell-owned-workspace-diagnostic/v1","runId":"15846cb455d965a4f268400160715cb3","startedAt":"2026-10-29T22:45:46.698394039Z","finishedAt":"2026-10-29T22:45:47.690685568Z","ownedSessions":11,"changes":{"schemaVersion":"dataground.workspace-changes/v1","digest":"sha256:1109a96bc3355a8d96195ba83bcef8e9a0c3a6152af25ce86922af7264302ce7","sizeBytes":678,"baseArchiveDigest":"sha256:923eacd2ade97fcaa909d0427e23a1a868f5e7ee1c15f82c476d2207bfc7c613","resultArchiveDigest":"sha256:5769c00152b750d617e2694f48918fa96788fb069510ac4324fef47879fc9727","changeCount":5,"entryCount":6,"sourceBytes":15},"checks":["owned-model-sessions","terminal-owner-acknowledgements","detached-writer-observed","binary-change-export","exact-repeated-export","restored-tree","cross-domain-denial"]},"workspaceSource":{"profile":"openshell-workspace-source-diagnostic/v1","runId":"15846cb455d965a4f268400160715cb3","startedAt":"2026-10-29T22:44:47.547451863Z","finishedAt":"2026-10-29T22:44:48.95365887Z","archiveDigest":"sha256:923eacd2ade97fcaa909d0427e23a1a868f5e7ee1c15f82c476d2207bfc7c613","checks":["cross-domain-denial","source-installation","exact-read-back","substitution-denial","native-source-content","native-source-executable"]},"supervisorCandidate":{"profile":"openshell-supervisor-candidate/v1","sourceCommit":"d556748771c41cbbd4e4dd7cd9030c798afe2b7d","patchSHA256":"5e97724dd9d9e7fad9abed8a46b9a4d6e06979119998c411daf34b2423056057"},"policySource":{"profile":"rosetta-development/v1","compilerSourceCommit":"320158f1e4a4eea378d82c1527f4a7af5fb9855b","inputSHA256":"b2895b9172c50ba7a5fdf574cebdf6789258cc8ce9f90ce5ad8f2b1ff0a825ab"},"candidateCredentialCheck":"passed","schemaVersion":"dataground.dev.openshell-runtime-diagnostic/v7","certificationEligible":false,"profile":{"runtimePolicySHA256":"a1d56c0470c3264c4c37183352d783ebb67911d92ef2eb6ec5f7c76c61f69f39","openshellCommit":"d556748771c41cbbd4e4dd7cd9030c798afe2b7d","gatewayImage":"ghcr.io/nvidia/openshell/gateway@sha256:e21f520a0678ba3cfe749957338b5fa78c75e8e52de13e4559ccbb582f781a0b","supervisorImage":"sha256:57cc182a7c56cf1fbd64af8b09b2196eea727783eb9ec0c2292542e3be0f755c","sandboxImage":"sha256:89d6c779be2e1ad8afadc22adbec36eb8f0eab3396107237a82829673c66202e","runtimeVersion":"0.117.0","runtimeSchemaCanonicalSHA256":"0668eee0081dc5b643ecc7821938ad174f3d532a313a092f387fed3b469876ea","gatewayEndpoint":"http://127.0.0.1:8080","driver":"docker","composeSHA256":"23e7b8fefea1cb51ea3740b6f2c2b9b5a3cd341bbad873e8ace9bb5612c6ad53","gatewayConfigSHA256":"9db5209f411ede9699c58c9e377a1a55958492962f69a3376913eb5210b65983"},"run":{"id":"15846cb455d965a4f268400160715cb3","resources":{"gateway":"dg-runtime-gateway-15846cb455d965a4f268400160715cb3","sandbox":"dg-runtime-sandbox-15846cb455d965a4f268400160715cb3","provider":"dg-runtime-provider-15846cb455d965a4f268400160715cb3","runtime":"dg-runtime-session-15846cb455d965a4f268400160715cb3","workspace":"dg-runtime-15846cb455d965a4f268400160715cb3"},"startedAt":"2026-10-29T22:44:48.953749162Z","finishedAt":"2026-10-29T22:45:48.24032787Z","origin":"local","sourceCommit":"dbafc6ed3dfdd5c7ebf122d485a79467ad331acd","model":"gpt-6-astra"},"checks":[{"name":"gateway-ready","status":"passed","startedAt":"2026-10-29T22:44:48.95375287Z","finishedAt":"2026-10-29T22:44:48.953753579Z","observationCommitment":"sha256:8945eff17f7d80cf213e7cff2592e2f88c05595b173bf19c9f942e1dc2853c58","nativeProtocolExposed":false,"upstreamEndpointExposed":false},{"name":"sandbox-ready","status":"passed","startedAt":"2026-10-29T22:44:48.953760704Z","finishedAt":"2026-10-29T22:44:48.955698091Z","observationCommitment":"sha256:28810e90b261f518cac9d68110a6b2886dc17384532eaf04ce34a9b1c414c4e5","nativeProtocolExposed":false,"upstreamEndpointExposed":false},{"name":"initialize","status":"passed","startedAt":"2026-10-29T22:44:48.955707216Z","finishedAt":"2026-10-29T22:44:49.335585725Z","observationCommitment":"sha256:7a1d314fe809727114b746e450ff20d556502aa5638f56383e02e1bce77552c5","nativeProtocolExposed":false,"upstreamEndpointExposed":false},{"name":"turn-success","status":"passed","startedAt":"2026-10-29T22:44:49.33562185Z","finishedAt":"2026-10-29T22:45:24.124706997Z","observationCommitment":"sha256:5ed19b21b38fbf74ed6eeab91344c507b84cb5a5579ad522721e4cd54b7153e5","nativeProtocolExposed":false,"upstreamEndpointExposed":false},{"name":"turn-failure","status":"passed","startedAt":"2026-10-29T22:45:24.124803498Z","finishedAt":"2026-10-29T22:45:24.937272963Z","observationCommitment":"sha256:9649dbcb3b50bc7719a40be2d5250328e3343303045aaedc6d7f915a6f761c05","nativeProtocolExposed":false,"upstreamEndpointExposed":false},{"name":"event-normalization","status":"passed","startedAt":"2026-10-29T22:45:24.937360464Z","finishedAt":"2026-10-29T22:45:31.224301956Z","observationCommitment":"sha256:cc3733e33e4dcb27c732bdfcffb7106dc6c9fa544914fe6e4f987bd54219621e","nativeProtocolExposed":false,"upstreamEndpointExposed":false},{"name":"interrupt","status":"passed","startedAt":"2026-10-29T22:45:31.224399665Z","finishedAt":"2026-10-29T22:45:31.580669818Z","observationCommitment":"sha256:64b95718f5c4f0a4fa65548971473a3d8bfe340c9ac27e806a886a2e59fb0661","nativeProtocolExposed":false,"upstreamEndpointExposed":false},{"name":"cancellation","status":"passed","startedAt":"2026-10-29T22:45:31.580689027Z","finishedAt":"2026-10-29T22:45:31.975040457Z","observationCommitment":"sha256:d5556c27701f8898f91b4f2a2daa1d3dd6ecf34ded41b2230222a7d17a754e1b","nativeProtocolExposed":false,"upstreamEndpointExposed":false},{"name":"command-approval","status":"passed","startedAt":"2026-10-29T22:45:31.975060665Z","finishedAt":"2026-10-29T22:45:35.885168882Z","observationCommitment":"sha256:b7f86d49a3da40c8243cf3a8d0df3d87f0d25e9e895ad0c3b90f85fdadf4c033","nativeProtocolExposed":false,"upstreamEndpointExposed":false},{"name":"file-change-approval","status":"passed","startedAt":"2026-10-29T22:45:35.885366633Z","finishedAt":"2026-10-29T22:45:39.97620217Z","observationCommitment":"sha256:a0d38e0db13ca8ff4838655a958336556efb1aab6ef4232cbbda97c93a1e6cd3","nativeProtocolExposed":false,"upstreamEndpointExposed":false},{"name":"artifact-export","status":"passed","startedAt":"2026-10-29T22:45:39.976296379Z","finishedAt":"2026-10-29T22:45:48.126628378Z","observationCommitment":"sha256:b8f53efdfd3058f91fca2945a968e8cbe3051bbe35ea13532ac6037e184ed450","nativeProtocolExposed":false,"upstreamEndpointExposed":false},{"name":"sandbox-teardown","status":"passed","startedAt":"2026-10-29T22:45:48.126830296Z","finishedAt":"2026-10-29T22:45:48.231753901Z","observationCommitment":"sha256:f24d6459623c198c02fbd1bf732825d22db9806869baf7def0691b46cf37ca02","nativeProtocolExposed":false,"upstreamEndpointExposed":false}],"cleanup":{"sandbox":{"name":"dg-runtime-sandbox-15846cb455d965a4f268400160715cb3","status":"removed"},"providerBinding":{"name":"dg-runtime-provider-15846cb455d965a4f268400160715cb3","status":"removed"},"workspace":{"name":"dg-runtime-15846cb455d965a4f268400160715cb3","status":"removed"}},"result":"passed"}
